{
  "$schema": "http://json-schema.org/draft-07/schema#",
  "$id": "schema/scenario.schema.json",
  "definitions": {      
    "resolution": {
      "$id": "#resolution",
      "type": "object",
      "properties": {
        "id": {
          "type": "string"
        },
        "title": {
          "type": "string"
        },
        "text": {
          "type": "string"
        },
        "resolution": {
          "type": "string"
        },
        "steps": {
          "type": "array",
          "items": {
            "type": "string"
          }
        }
      },
      "required": [
        "id"
      ],
      "additionalProperties": false
    }
  },
  "type": "object",
  "properties": {
    "scenarioName": {
      "type": "string"
    },
    "setup": {
      "type": "array",
      "items": {
        "type": "string"
      }
    },
    "resolutions": {
      "type": "array",
      "items": {
        "$ref": "#resolution"
      }
    },
    "steps": {
      "type": "array",
      "items": {
        "$ref": "schema/step.schema.json#/definitions/step"
      }
    },
    "interlude": {
      "type": "boolean"
    }
  },
  "required": [
    "scenarioName",
    "setup",
    "steps"
  ],
  "additionalProperties": false
}