{
  "scenarioName": "Restless Nights",
  "interlude": true,
  "setup": [
    "prologue"
  ],
  "steps": [
    {
      "id": "prologue",
      "type": "story",
      "text": "Inside the chamber that contained the terrible beast, you find the missing townsfolk and the others from Arkham; they are bound and shackled. You also find several documents that suggest the creature you found isn’t the only one of its kind in Dunwich. You free the creature’s victims from their bonds, and they offer you their thanks. You begin to plan your next move."
    }
  ]
}